link,title,content,date,polarity,subjectivity
/news/walt-disney-started-outperform-bernstein-055654422.html,Walt Disney started with Outperform at Bernstein: 4 big analyst picks,"Investing.com — Here is your Pro Recap of the biggest analyst picks you may have missed since yesterday: an Outperform initiation at Walt Disney , and upgrades at Vale, Shoals Technologies Group , and TE Connectivity.
Bernstein initiated coverage on Walt Disney (NYSE:DIS) with an Outperform rating and a price target of $103.00.
The firm is optimistic about Disney's potential to transition to direct-to-consumer (DTC) streaming successfully once combined with Hulu.
We forecast DTC growth to outpace Linear decline, supporting overall growth of Media, with DTC revenue surpassing Linear revenue in 2024, and Disney becoming the undisputed #2 SVOD.
The firm foresees EBITDA margin expansion from around 18% to the low 20s for the foreseeable future. “Hulu is a near-term controversy due to the uncertainty about how much Disney will end up paying for CMCSA's 1/3 stake in Hulu, but we believe the range of outcomes is narrow,” commented Bernstein. According to the firm, Disney stands to benefit significantly from full control of the asset, and if the deal is resolved positively, it could lift a modest overhang on the stock.
According to the bank, the commodities and mining sector's outlook is balanced due to China's efforts to support its economy and the offsetting effects of property market weakness with strength in infrastructure and other sectors.
According to UBS, the key driver for Vale is the iron ore price, which is expected to remain within the range of $100-130 per ton over the next six months. This allows Vale to offer an attractive dividend of approximately $4.6 billion (approximately 8% yield) over the next year and buy back stock.
Shoals Technologies Group (NASDAQ:SHLS) shares gained more than 4% pre-market today after Piper Sandler upgraded the company to Overweight from Neutral with a price target of $28.00.
TE Connectivity (NYSE:TEL) shares rose more than 1% pre-market today after TD Cowen upgraded the company to Outperform from Market Perform with a price target of $140.00.
Related Articles",2023-10-06,0.09765395894428154,0.4909824046920821
/news/vale-vale-stock-drops-despite-220019733.html,VALE S.A. (VALE) Stock Drops Despite Market Gains: Important Facts to Note,"The most recent trading session ended with VALE S.A. (VALE) standing at $12.76, reflecting a -0.93% shift from the previouse trading day's closing. This change lagged the S&P 500's daily gain of 0.81%. Elsewhere, the Dow gained 0.39%, while the tech-heavy Nasdaq added 1.35%.
Shares of the company have depreciated by 7.2% over the course of the past month, outperforming the Basic Materials sector's loss of 7.36% and lagging the S&P 500's loss of 6.19%.
Analysts and investors alike will be keeping a close eye on the performance of VALE S.A. in its upcoming earnings disclosure. In that report, analysts expect VALE S.A. to post earnings of $0.71 per share. This would mark a year-over-year decline of 27.55%. Meanwhile, our latest consensus estimate is calling for revenue of $11.23 billion, up 13.09% from the prior-year quarter.
For the entire fiscal year, the Zacks Consensus Estimates are projecting earnings of $2.05 per share and a revenue of $41.01 billion, representing changes of -43.21% and -6.45%, respectively, from the prior year.
Additionally, investors should keep an eye on any recent revisions to analyst forecasts for VALE S.A. Recent revisions tend to reflect the latest near-term business trends. With this in mind, we can consider positive estimate revisions a sign of optimism about the company's business outlook.
Our research suggests that these changes in estimates have a direct relationship with upcoming stock price performance. To exploit this, we've formed the Zacks Rank, a quantitative model that includes these estimate changes and presents a viable rating system.
The Zacks Rank system, which varies between #1 (Strong Buy) and #5 (Strong Sell), carries an impressive track record of exceeding expectations, confirmed by external audits, with stocks at #1 delivering an average annual return of +25% since 1988. Over the past month, there's been a 6.63% rise in the Zacks Consensus EPS estimate. At present, VALE S.A. boasts a Zacks Rank of #3 (Hold).
Investors should also note VALE S.A.'s current valuation metrics, including its Forward P/E ratio of 6.28. This represents a discount compared to its industry's average Forward P/E of 7.34.
The Mining - Iron industry is part of the Basic Materials sector. This industry currently has a Zacks Industry Rank of 6, which puts it in the top 3% of all 250+ industries.
The Zacks Industry Rank assesses the vigor of our specific industry groups by computing the average Zacks Rank of the individual stocks incorporated in the groups. Our research shows that the top 50% rated industries outperform the bottom half by a factor of 2 to 1.
You can find more information on all of these metrics, and much more, on Zacks.com.",2023-10-04,0.004431818181818173,0.47821969696969696
/news/wall-street-analysts-think-vale-135504864.html,Wall Street Analysts Think VALE S.A. (VALE) Could Surge 29.02%: Read This Before Placing a Bet,"VALE S.A. (VALE) closed the last trading session at $13.23, gaining 0.5% over the past four weeks, but there could be plenty of upside left in the stock if short-term price targets set by Wall Street analysts are any guide. The mean price target of $17.07 indicates a 29% upside potential.
The mean estimate comprises 10 short-term price targets with a standard deviation of $2.13. While the lowest estimate of $13.20 indicates a 0.2% decline from the current price level, the most optimistic analyst expects the stock to surge 51.2% to reach $20. It's very important to note the standard deviation here, as it helps understand the variability of the estimates. The smaller the standard deviation, the greater the agreement among analysts.
While the consensus price target is a much-coveted metric for investors, solely banking on this metric to make an investment decision may not be wise at all. That's because the ability and unbiasedness of analysts in setting price targets have long been questionable.
But, for VALE, an impressive average price target is not the only indicator of a potential upside. Strong agreement among analysts about the company's ability to report better earnings than they predicted earlier strengthens this view. While a positive trend in earnings estimate revisions doesn't gauge how much a stock could gain, it has proven to be powerful in predicting an upside.
Here's What You Should Know About Analysts' Price Targets
According to researchers at several universities across the globe, a price target is one of many pieces of information about a stock that misleads investors far more often than it guides. In fact, empirical research shows that price targets set by several analysts, irrespective of the extent of agreement, rarely indicate where the price of a stock could actually be heading.
While Wall Street analysts have deep knowledge of a company's fundamentals and the sensitivity of its business to economic and industry issues, many of them tend to set overly optimistic price targets. Are you wondering why?
They usually do that to drum up interest in shares of companies that their firms either have existing business relationships with or are looking to be associated with. In other words, business incentives of firms covering a stock often result in inflated price targets set by analysts.
However, a tight clustering of price targets, which is represented by a low standard deviation, indicates that analysts have a high degree of agreement about the direction and magnitude of a stock's price movement. While that doesn't necessarily mean the stock will hit the average price target, it could be a good starting point for further research aimed at identifying the potential fundamental driving forces.
That said, while investors should not entirely ignore price targets, making an investment decision solely based on them could lead to disappointing ROI. So, price targets should always be treated with a high degree of skepticism.
Why VALE Could Witness a Solid Upside
Analysts' growing optimism over the company's earnings prospects, as indicated by strong agreement among them in revising EPS estimates higher, could be a legitimate reason to expect an upside in the stock. That's because empirical research shows a strong correlation between trends in earnings estimate revisions and near-term stock price movements.
Over the last 30 days, the Zacks Consensus Estimate for the current year has increased 8.5%, as two estimates have moved higher while one has gone lower.
Moreover, VALE currently has a Zacks Rank #2 (Buy), which means it is in the top 20% of more than the 4,000 stocks that we rank based on four factors related to earnings estimates. Given an impressive externally-audited track record, this is a more conclusive indication of the stock's potential upside in the near term. You can see the complete list of today's Zacks Rank #1 (Strong Buy) stocks here >>>>
Therefore, while the consensus price target may not be a reliable indicator of how much VALE could gain, the direction of price movement it implies does appear to be a good guide.",2023-09-29,0.10272122898746276,0.49922513633552584
/news/vale-vale-stock-sinks-market-220018144.html,VALE S.A. (VALE) Stock Sinks As Market Gains: What You Should Know,"VALE S.A. (VALE) closed at $12.99 in the latest trading session, marking a -0.84% move from the prior day. This change lagged the S&P 500's daily gain of 0.02%. At the same time, the Dow lost 0.2%, and the tech-heavy Nasdaq gained 0.22%.
Heading into today, shares of the company had lost 1.73% over the past month, lagging the Basic Materials sector's gain of 0.76% and outpacing the S&P 500's loss of 2.86% in that time.
VALE S.A. will be looking to display strength as it nears its next earnings release. On that day, VALE S.A. is projected to report earnings of $0.65 per share, which would represent a year-over-year decline of 33.67%. Our most recent consensus estimate is calling for quarterly revenue of $11.23 billion, up 13.09% from the year-ago period.
VALE's full-year Zacks Consensus Estimates are calling for earnings of $1.95 per share and revenue of $41.01 billion. These results would represent year-over-year changes of -45.98% and -6.45%, respectively.
Any recent changes to analyst estimates for VALE S.A. should also be noted by investors. These revisions typically reflect the latest short-term business trends, which can change frequently. As such, positive estimate revisions reflect analyst optimism about the company's business and profitability.
Based on our research, we believe these estimate revisions are directly related to near-team stock moves. We developed the Zacks Rank to capitalize on this phenomenon. Our system takes these estimate changes into account and delivers a clear, actionable rating model.
The Zacks Rank system, which ranges from #1 (Strong Buy) to #5 (Strong Sell), has an impressive outside-audited track record of outperformance, with #1 stocks generating an average annual return of +25% since 1988. The Zacks Consensus EPS estimate has moved 3.17% higher within the past month. VALE S.A. currently has a Zacks Rank of #2 (Buy).
Investors should also note VALE S.A.'s current valuation metrics, including its Forward P/E ratio of 6.72. This valuation marks a discount compared to its industry's average Forward P/E of 8.75.
The Mining - Iron industry is part of the Basic Materials sector. This group has a Zacks Industry Rank of 108, putting it in the top 43% of all 250+ industries.
The Zacks Industry Rank gauges the strength of our industry groups by measuring the average Zacks Rank of the individual stocks within the groups. Our research shows that the top 50% rated industries outperform the bottom half by a factor of 2 to 1.
Make sure to utilize Zacks.com to follow all of these stock-moving metrics, and more, in the coming trading sessions.",2023-09-27,-0.0033189033189033245,0.4720478595478595
/news/vale-vale-port-acu-build-152900575.html,Vale (VALE) & Port of Acu to Build Low-Carbon Iron Ore Complex,"Vale S.A. VALE has signed a memorandum of understanding with the Port of Açu to explore the possibility of the development of a Mega Hub as part of its decarbonization efforts. The Mega Hub will include a plant, which will produce hot briquetted iron (HBI) using the direct reduction route. This is a groundbreaking initiative as it is expected to produce HBI with near-zero carbon emission.
The Port of Açu, located in the northern region of Rio de Janeiro, is the largest deep-sea port complex in Latin America. The port authorities have been focused on low-carbon projects in order to be recognized as the energy transition port of Brazil.
HBI is considered as an important intermediate steel product to reduce harmful emissions as it eliminates the need to use dirty coke or coal in steel manufacturing. Currently, HBI is mostly used in electric arc furnaces. A technical study will be coordinated by the Port of Açu and researchers to explore the use of HBI as partial burden in blast-furnaces. This will help in lowering carbon dioxide emissions by about 25% (with even greater potential reductions along the supply chain) while increasing blast furnace productivity.Mega Hubs are industrial complexes designed to produce low-carbon steel products. Vale has announced plans to build such hubs in Saudi Arabia, UAE and Oman, with the first hub expected to go live in 2027.
The Mega Hub in Brazil, which will be developed with the Port of Acu, will initially receive pellets from Vale. In the future, it might include an iron ore briquette plant at site to supply the direct reduction route at the industrial complex. As per the agreement, both companies will look for investors to build and operate the Direct Reduction plant using natural gas, which will be available at the port, with the possibility of eventually converting to green hydrogen. This will help in producing HBI, thus ensuring near-zero carbon emissions.
This endeavor will open up the possibility of the development of further Mega Hubs in Brazil. It will largely contribute to the decarbonization of the domestic and international steel industry.
Shares of Vale have gained 4.4% in a year, in line with the industry.
Image Source: Zacks Investment Research
Vale currently carries a Zacks Rank #3 (Hold).
Some better-ranked stocks from the basic materials space are Hawkins, Inc. HWKN, Carpenter Technology Corporation CRS and L.B. Foster Company FSTR. HWKN and CRS sport a Zacks Rank #1 (Strong Buy) at present, and FSTR carries a Zacks Rank #2 (Buy). You can see the complete list of today’s Zacks #1 Rank stocks here.
Hawkins has an average trailing four-quarter earnings surprise of 25.5%. The Zacks Consensus Estimate for HWKN’s fiscal 2024 earnings is pegged at $3.40 per share. The consensus estimate for 2024 earnings has moved 38% north in the past 60 days. Its shares have gained 57% in the last year.
Carpenter Technology has an average trailing four-quarter earnings surprise of 10%. The Zacks Consensus Estimate for CRS’s fiscal 2024 earnings is pegged at $3.48 per share. The consensus estimate for 2023 earnings has moved 8% north in the past 60 days. Its shares have surged 107% in the last year.
L.B. Foster has an average trailing four-quarter earnings surprise of 134.5%. The Zacks Consensus Estimate for FSTR’s 2023 earnings is pegged at 53 cents per share. Earnings estimates have been unchanged in the past 60 days. FSTR’s shares have gained 95% in the last year.",2023-09-27,-0.050333694083694085,0.4176091269841269
