link,title,content,date,polarity,subjectivity
/news/10-stocks-bounce-back-according-171412601.html,10 Stocks that Will Bounce Back According to Reddit,"US stock markets were wavering after latest inflation data showed pricing pressures are returning, albeit due to rising oil prices. Despite the ifs and buts, it’s clear that the Fed has not been able to get the results it wanted (so far) with its persistent rate hikes. Investors were too early to cheer the start of the bull market. The Fed could very well begin another set of rate hikes, and even if it holds back on rate hikes for now the first half of 2024 could be jittery for the stock market. But stock markets have always been like this; always moving on news cycles and investors always looking over their shoulder for that next important data point and report. If we zoom out, though, we will notice that stock markets tend to move upwards in the long run and investors who give up too early and sell based on news cycles end up losing most of those sweet gains.
“Even if I look at the United States with its 3500 some odd publicly traded businesses, an investment manager can really not drill down on more than a few dozen of them every year. So they have to make a decision relatively quickly on which ones they are or are not going to focus on. Commitment bias that comes in once we start spending time on something, our brains play games with us. One of the games our brain plays is that we feel entitled. “Hey, if I spent some time on it, I ought to make money on it”. And that’s really not how investing works. I think it’s very important to be aware of commitment bias, and to be very aware that the first two or three minutes that when you’re looking at a company are when you have to make the call. It’s okay to let a winner go, but more important not to let a loser stay.”
Our Methodology
In this article we scoured several Reddit subreddits like Investing, StockMarket, Stocks, Wall Street Bets, among others, to see which stocks Redditors believe will rebound from their lows in the future. We picked only those stocks that are down year to date or over the past 12 months with a positive sentiment on Reddit. Redditors either believe these companies are undervalued or the selloff around them is overdone. The list is ranked in ascending order of the number of hedge fund investors around each stock.
Number of Hedge Fund Holders: 12
Lithium Americas Corp. (NYSE:LAC) shares have lost about 40% over the past one year. Lithium Americas Corp. (NYSE:LAC) is one of the top lithium stocks loved by Redditors and many on the platform believe the stock is offering a good entry point for the long term.
Lithium Americas Corp. (NYSE:LAC) is currently on investors’ radar after reports said an estimated 20 to 40 million tonnes of lithium reserves are found near the company’s Thacker Pass project.
As of the end of the second quarter of 2023, 12 hedge funds tracked by Insider Monkey reported owning stakes in Lithium Americas Corp. (NYSE:LAC).
“During the first quarter, Lithium Americas Corp. (NYSE:LAC) had several positive events, including a favorable record of decision ruling for Thacker Pass, paving the way for construction of the mine to start, a revised Thacker resource/cost estimates, and GM’s financing/offtake agreement. Even though LAC is non-producing and its stock is down 34% over the past year (compared to the larger lithium producer’s 3%), the stock remains one of our favorites with multiple catalysts (and still up roughly 600% from our initial purchase price):
Number of Hedge Fund Holders: 22
Clothing company Levi Strauss shares fell sharply in July after the company cut its FY23 revenue growth guidance range and also decreased its FY23 profit guidance by 15%.
In the second quarter, Levi Strauss's adjusted EPS came in at $0.04 beating estimates by $0.01.  Revenue in the period came in at $1.34 billion, meeting estimates.
LEVI has a PE ratio of 12.40 as of September 13. Levi’s is also a strong dividend payer, with an over 3% yield. Redditors believe the stock can rebound when inflation pressures subside and the consumer will have confidence and buying power to boost their spending.
“Driven by our ongoing execution in surgical pricing action U.S. wholesale will stabilize and end the year as a smaller share of our business at less than 30%. Inventories are expected to end 2023 below prior year levels. Our 2023 gross margin is expected to remain 300 basis points higher than 2019 and we will exit the year with Q4 EBIT margins north of 12%. And importantly, we continue to return cash to our shareholders with a payout ratio of 150% of free-cash flow substantially higher than our targeted 55% to 65% communicated at our Investor Day. Lastly, while we are lowering our H2 outlook because of U.S. wholesale, we expect the strong growth in our large fast growing DTC and international businesses to continue, which as U.S. wholesale stabilizes and COGS improves will position our unique business model to generate significant financial leverage beyond 2023.”
Number of Hedge Fund Holders: 30
Metals and mining company Vale SA (NYSE:VALE)’s stock has lost about 16% year to date through September 13. Redditors believe Vale SA (NYSE:VALE) can rebound. One Redditor, for example, said in a stock discussion thread:
“Im waiting on VALE to catch a low. Its in the murky cross over of an up swing. Looking to hold for a few months for roughly a 25% gain. If it runs to what it did after covid, ~55%. I've got a buy limit order in, hopefully penny pinching doesn't hurt me while I'm gone on a week vacation.”
Earlier this month, J.P. Morgan upgraded Vale SA (NYSE:VALE) from Neutral. JPMorgan said the stock is undervalued when compared to its peers.
“Current iron ore prices are being supported by improved sentiment on China reopening and robust steel output. Current valuation looks discounted as the stock has de-rated, currently down 27.2% year-to-date, and has been outperformed by iron ore,” JPMorgan’s Rodolfo Angele said.
“Vale S.A. (NYSE:VALE) fell during the quarter with iron ore prices. The company reported 1Q23 revenue of $8.44B, -22.7% Y/Y, below consensus of $8.79B, and Adjusted EBITDA of $3.69B, compared to 1Q22 EBITDA of $6.55B, below consensus of $4.49B. The Brazilian miner produced 66.8 million tons (Mt) of iron ore in 1Q23, +5.8% Y/Y, below consensus of 67.7 Mt, 67.0 thousand tons (kt) of copper, +18.4% Y/Y, and 41.0 kt of nickel, -10.5% Y/Y. Although management reaffirmed its FY23 production guidance, analysts seemed to be concerned by the negatively offsetting impacts of weaker iron ore prices as China, the world’s largest iron ore buyer, has threatened to curb any “unreasonable” price gains for the metal in an effort to prevent this year’s steel output from exceeding 2022 levels. Vale generated 1Q23 free cash flow (FCF) of $2.28B, bringing trailing-twelve month (TTM) FCF to $6.73B, or a FCF yield of 11.3%. The company repurchased $763MM worth of shares in the quarter and paid $1.80B in dividends, bringing total capital returned to shareholders in the quarter to $2.56B, or 4.3% of the company’s market cap.”
Number of Hedge Fund Holders: 45
Target Corporation (NYSE:TGT) shares are down about 16% year to date. Target Corporation (NYSE:TGT) suffered a backlash from customers earlier this year after it showcased LGBT merchandize at its stores. Target Corporation (NYSE:TGT) later moved this LGBT-focused merchandize from “the front of the stores to the back” in some stores.
In August Target Corporation (NYSE:TGT) posted second quarter results. Adjusted EPS in the quarter came in at $1.80 beating estimates by $0.38. Revenue in the period came in at $24.77 billion, missing estimates by $460 million.
As of the end of the first quarter of 2023, 45 hedge funds out of the 910 hedge funds tracked by Insider Monkey reported owning stakes in Target Corporation (NYSE:TGT).
“We also purchased an ownership stake in Target Corporation (NYSE:TGT) , the US-based mass retailer. The company has experienced strong traffic growth over the past several years but was disproportionally impacted by poor internal inventory forecasting in 2022, which caused near-term profitability to be negatively impacted. As near-term headwinds subside, we believe Target can restore its margin profile on a sales base that has seen a significant increase since the beginning of the pandemic. The recent stock price sell-off related to near-term controversy concerns allowed us to initiate a position at an attractive discount to our estimate of intrinsic value. Looking past the next couple of quarters, we believe Target is well positioned to gain share longer-term due to its merchandising acumen, real estate locations and omnichannel capabilities.”
Number of Hedge Fund Holders: 50
Enphase Energy Inc. (NASDAQ:ENPH) ranks 6th in our list of stocks that will bounce back according to Reddit. Recently, BMO Capital mentioned a list of stocks that have grown at a “reasonable price.” Enphase Energy Inc. (NASDAQ:ENPH) was part of the list with an Outperform rating set by BMO.
As of the end of the second quarter of 2023, 50 hedge funds tracked by Insider Monkey reported owning stakes in Enphase Energy Inc. (NASDAQ:ENPH). The biggest stakeholder of Enphase Energy Inc. (NASDAQ:ENPH) was Philippe Laffont’s Coatue Management which owns a $103 million stake in the company.
“Enphase Energy provides solar microinverters and energy storage solutions. The company’s shares lagged benchmark counterparts amid concerns surrounding a near-term moderation in the growth of residential solar installation in the United States. Despite this, the company possesses a market-leading position in its core microinverter product and remains wellpositioned over the long term to benefit from ongoing solar adoption trends. Additionally, Enphase is focused on growing its international presence while also unveiling new products that could provide the next tailwind to its growth story.”
 
 
Suggested articles:
Disclosure: None. 10 Stocks that Will Bounce Back According to Reddit is originally published on Insider Monkey.",2023-09-24,0.08213189260433354,0.3659590846598719
/news/3-dividend-stocks-100-total-224240178.html,3 Dividend Stocks for 100% Total Returns by 2025,"Of course, there are fundamental factors for depressed valuations. I however believe that these stories will emerge from near-term headwinds to surge higher in the next two years. Let’s discuss the reasons to be bullish on these dividend stocks to buy.
Source: IgorGolovniov/Shutterstock.com
It’s worth noting that Albemarle is on a high-growth trajectory. For the year, the company has guided for revenue growth in the range of 40% to 55%. On the flip-side, the EBITDA margin is likely to decline by 1,000 basis points to 37%. However, that’s due to near-term weakness in lithium price.
With nearly tripling of capacity, revenue and EBITDA growth is likely to be robust. The combination of strong fundamentals bring it to the top of my list of dividend stocks to buy.
Source: Shutterstock
I believe that debt is the key headwind for AT&T. Even after debt reduction of $20 billion in the last three years, the company reported net debt of $132 billion as of Q2 2023.
Source: rafapress / Shutterstock.com
With a diversified portfolio, the long-term outlook is positive.",2023-09-19,0.12966200466200467,0.4784965034965035
/news/vale-vale-gains-market-dips-220017362.html,VALE S.A. (VALE) Gains As Market Dips: What You Should Know,"VALE S.A. (VALE) closed at $14.12 in the latest trading session, marking a +0.07% move from the prior day. The stock outpaced the S&P 500's daily loss of 0.22%. Meanwhile, the Dow lost 0.31%, and the Nasdaq, a tech-heavy index, lost 0.23%.
Prior to today's trading, shares of the company had gained 14.72% over the past month. This has outpaced the Basic Materials sector's gain of 3.52% and the S&P 500's gain of 2.08% in that time.
Wall Street will be looking for positivity from VALE S.A. as it approaches its next earnings report date. The company is expected to report EPS of $0.57, down 41.84% from the prior-year quarter. Meanwhile, our latest consensus estimate is calling for revenue of $10.7 billion, up 7.73% from the prior-year quarter.
For the full year, our Zacks Consensus Estimates are projecting earnings of $1.92 per share and revenue of $39.29 billion, which would represent changes of -46.81% and -10.39%, respectively, from the prior year.
Any recent changes to analyst estimates for VALE S.A. should also be noted by investors. Recent revisions tend to reflect the latest near-term business trends. As such, positive estimate revisions reflect analyst optimism about the company's business and profitability.
Based on our research, we believe these estimate revisions are directly related to near-team stock moves. To benefit from this, we have developed the Zacks Rank, a proprietary model which takes these estimate changes into account and provides an actionable rating system.
The Zacks Rank system, which ranges from #1 (Strong Buy) to #5 (Strong Sell), has an impressive outside-audited track record of outperformance, with #1 stocks generating an average annual return of +25% since 1988. Over the past month, the Zacks Consensus EPS estimate has moved 1.72% higher. VALE S.A. currently has a Zacks Rank of #5 (Strong Sell).
Investors should also note VALE S.A.'s current valuation metrics, including its Forward P/E ratio of 7.34. This represents a discount compared to its industry's average Forward P/E of 9.4.
The Mining - Iron industry is part of the Basic Materials sector. This industry currently has a Zacks Industry Rank of 252, which puts it in the bottom 1% of all 250+ industries.
The Zacks Industry Rank gauges the strength of our industry groups by measuring the average Zacks Rank of the individual stocks within the groups. Our research shows that the top 50% rated industries outperform the bottom half by a factor of 2 to 1.
You can find more information on all of these metrics, and much more, on Zacks.com.",2023-09-19,-0.00099887766554434,0.46002244668911324
/news/vale-vale-dips-more-broader-220020176.html,VALE S.A. (VALE) Dips More Than Broader Markets: What You Should Know,"VALE S.A. (VALE) closed the most recent trading day at $13.60, moving -0.66% from the previous trading session. This move lagged the S&P 500's daily loss of 0.57%. At the same time, the Dow lost 0.05%, and the tech-heavy Nasdaq lost 1.04%.
Heading into today, shares of the company had gained 9.78% over the past month, outpacing the Basic Materials sector's loss of 0.72% and the S&P 500's gain of 0.64% in that time.
Wall Street will be looking for positivity from VALE S.A. as it approaches its next earnings report date. In that report, analysts expect VALE S.A. to post earnings of $0.56 per share. This would mark a year-over-year decline of 42.86%. Meanwhile, the Zacks Consensus Estimate for revenue is projecting net sales of $10.57 billion, up 6.46% from the year-ago period.
Looking at the full year, our Zacks Consensus Estimates suggest analysts are expecting earnings of $1.92 per share and revenue of $39.29 billion. These totals would mark changes of -46.81% and -10.39%, respectively, from last year.
Investors should also note any recent changes to analyst estimates for VALE S.A.These revisions help to show the ever-changing nature of near-term business trends. As a result, we can interpret positive estimate revisions as a good sign for the company's business outlook.
Research indicates that these estimate revisions are directly correlated with near-term share price momentum. Investors can capitalize on this by using the Zacks Rank. This model considers these estimate changes and provides a simple, actionable rating system.
The Zacks Rank system ranges from #1 (Strong Buy) to #5 (Strong Sell). It has a remarkable, outside-audited track record of success, with #1 stocks delivering an average annual return of +25% since 1988. Within the past 30 days, our consensus EPS projection has moved 1.72% higher. VALE S.A. is currently sporting a Zacks Rank of #5 (Strong Sell).
In terms of valuation, VALE S.A. is currently trading at a Forward P/E ratio of 7.12. This represents a discount compared to its industry's average Forward P/E of 8.93.
The Mining - Iron industry is part of the Basic Materials sector. This industry currently has a Zacks Industry Rank of 251, which puts it in the bottom 1% of all 250+ industries.
The Zacks Industry Rank gauges the strength of our industry groups by measuring the average Zacks Rank of the individual stocks within the groups. Our research shows that the top 50% rated industries outperform the bottom half by a factor of 2 to 1.
You can find more information on all of these metrics, and much more, on Zacks.com.",2023-09-12,-0.004792107117688508,0.42040924192086987
/news/3-bargain-blue-chip-stocks-112935827.html,3 Bargain Blue-Chip Stocks to Buy Under $20,"On the other hand, there are attractive blue-chip stocks to buy that have remained sideways or lower. That’s not uncommon as there can potentially be company or industry specific headwinds that have depressed valuations. However, if fundamentals are robust, the under-performing stocks can be accumulated.
As the markets look for value, these stocks will be in the limelight and are likely to surge higher. The blue-chip stocks to buy that are discussed represent quality companies that have a positive outlook for the coming quarters.
My sense is that these undervalued blue-chip stocks can possibly deliver 100% total returns in the next 24 months. Let’s discuss the reasons to be positive on these stocks.
Source: rafapress / Shutterstock.com
Source: Funtap / Shutterstock.com
It’s worth noting that T stock has remained depressed even after the spin-off of the media division. At the same time, business developments have been positive and the company continues to deleverage. Re-rating of the stock is inevitable, which will be a catalyst for a big rally.
Overall, AT&T continues to report healthy cash flows, which will be utilized for dividends, deleveraging, and capital investments.
Source: Shutterstock
An important point to note is that even with aggressive rate hikes, gold has sustained above $1,900 an ounce. I expect the precious metal to breakout on the upside backed by catalysts of inflation, geopolitical tension, and potential reversal in monetary policy in 2024.
It’s also worth noting that the company’s gold reserve replacement ratio has been above 100% in the last few years. A strong asset base ensures clear cash flow visibility. I also like the fact that Barrick Gold has quality copper assets. The demand for copper is likely to remain high on the back of the push for green energy. Barrick is positioned to benefit.
Faisal Humayun is a senior research analyst with 12 years of industry experience in the field of credit research, equity research and financial modeling. Faisal has authored over 1,500 stock specific articles with focus on the technology, energy and commodities sector.",2023-09-12,0.07500420875420874,0.49332491582491567
